{
  "plan_id": "p7q8r9s0-t1u2-v3w4-x5y6-z789012345ab",
  "intent_id": "a1b2c3d4-e5f6-7890-abcd-ef1234567890",
  "selected_capability": {
    "capability_id": "sip.knowledge.retrieve",
    "name": "Knowledge Retrieval",
    "description": "Retrieves semantically relevant documents from the enterprise knowledge base.",
    "provider": {
      "provider_id": "knowledge_service",
      "provider_name": "Enterprise Knowledge Service",
      "contact": null,
      "version": "1.2.0",
      "documentation_url": "https://internal.example.com/docs/knowledge"
    },
    "intent_domains": ["knowledge_management", "research"],
    "input_schema": {
      "schema_id": "sip.knowledge.retrieve.input.v1",
      "description": "Input parameters for knowledge retrieval",
      "properties": {
        "query": "string",
        "top_k": "integer"
      },
      "required_fields": ["query"]
    },
    "output_schema": {
      "schema_id": "sip.knowledge.retrieve.output.v1",
      "description": "Ranked list of relevant documents",
      "properties": {
        "documents": "array",
        "total_found": "integer"
      },
      "required_fields": ["documents"]
    },
    "operation_class": "retrieve",
    "risk_level": "low",
    "required_scopes": ["sip.knowledge.read"],
    "minimum_trust_tier": "internal",
    "supported_bindings": ["rag", "rest"],
    "execution": {
      "average_latency_ms": 250,
      "idempotent": true,
      "supports_dry_run": false,
      "max_retries": 3
    },
    "constraints": {
      "rate_limit_per_minute": 100,
      "requires_human_approval": false,
      "allowed_environments": ["production", "staging"]
    },
    "examples": [],
    "tags": ["knowledge", "retrieval", "rag"],
    "extensions": {}
  },
  "selected_binding": "rag",
  "deterministic_target": {
    "binding": "rag",
    "capability_id": "sip.knowledge.retrieve",
    "endpoint": null
  },
  "grounded_parameters": {
    "query": "Q4 2023 financial results",
    "top_k": 5,
    "format": "json"
  },
  "execution_steps": [
    {
      "step_index": 0,
      "step_name": "invoke_sip.knowledge.retrieve",
      "description": "Invoke 'Knowledge Retrieval' via rag binding for intent 'retrieve_document'.",
      "capability_id": "sip.knowledge.retrieve",
      "binding": "rag",
      "parameters": {
        "query": "Q4 2023 financial results",
        "top_k": 5,
        "format": "json"
      },
      "depends_on": []
    }
  ],
  "policy_checks_passed": [
    {
      "check_name": "trust_level",
      "result": "passed",
      "notes": "Actor trust 'internal' meets capability minimum 'internal'."
    },
    {
      "check_name": "operation_class_match",
      "result": "passed",
      "notes": "Intent operation class 'retrieve' matches capability 'retrieve'."
    }
  ],
  "approval_required": false,
  "trace": {
    "trace_id": "b2c3d4e5-f6a7-8901-bcde-f01234567891",
    "span_id": "c3d4e5f6-a7b8-9012-cdef-012345678902",
    "parent_span_id": null,
    "intent_id": "a1b2c3d4-e5f6-7890-abcd-ef1234567890"
  },
  "provenance_summary": null,
  "extensions": {}
}
